{
  "schema_version": "1.0",
  "kind": "task-graph",
  "id": "synthetic-example",
  "plan_id": "PLAN-001",
  "revision": 1,
  "status": "proposed",
  "nodes": [
    {
      "task_id": "TASK-001",
      "depends_on": []
    }
  ],
  "task_set_sha256": "bbbbbbbbbbbbbbbbbbbbbbbbbbbbbbbbbbbbbbbbbbbbbbbbbbbbbbbbbbbbbbbb",
  "review_ref": null
}
