{
  "schema_version": "1.0",
  "kind": "task-graph",
  "id": "PLAN-001-r2",
  "plan_id": "PLAN-001",
  "revision": 2,
  "status": "approved",
  "nodes": [
    {
      "task_id": "TASK-001",
      "depends_on": []
    },
    {
      "task_id": "TASK-002",
      "depends_on": [
        "TASK-001"
      ]
    },
    {
      "task_id": "TASK-003",
      "depends_on": [
        "TASK-001"
      ]
    },
    {
      "task_id": "TASK-004",
      "depends_on": [
        "TASK-001"
      ]
    },
    {
      "task_id": "TASK-005",
      "depends_on": [
        "TASK-004"
      ]
    },
    {
      "task_id": "TASK-006",
      "depends_on": [
        "TASK-002",
        "TASK-004",
        "TASK-038"
      ]
    },
    {
      "task_id": "TASK-007",
      "depends_on": [
        "TASK-002",
        "TASK-006"
      ]
    },
    {
      "task_id": "TASK-008",
      "depends_on": [
        "TASK-001",
        "TASK-004"
      ]
    },
    {
      "task_id": "TASK-009",
      "depends_on": [
        "TASK-002",
        "TASK-007",
        "TASK-008"
      ]
    },
    {
      "task_id": "TASK-010",
      "depends_on": [
        "TASK-009"
      ]
    },
    {
      "task_id": "TASK-011",
      "depends_on": [
        "TASK-007",
        "TASK-010"
      ]
    },
    {
      "task_id": "TASK-012",
      "depends_on": [
        "TASK-011"
      ]
    },
    {
      "task_id": "TASK-013",
      "depends_on": [
        "TASK-001",
        "TASK-004"
      ]
    },
    {
      "task_id": "TASK-014",
      "depends_on": [
        "TASK-001",
        "TASK-004"
      ]
    },
    {
      "task_id": "TASK-015",
      "depends_on": [
        "TASK-003",
        "TASK-013",
        "TASK-014",
        "TASK-017",
        "TASK-039"
      ]
    },
    {
      "task_id": "TASK-016",
      "depends_on": [
        "TASK-003",
        "TASK-004",
        "TASK-038"
      ]
    },
    {
      "task_id": "TASK-017",
      "depends_on": [
        "TASK-003",
        "TASK-004",
        "TASK-038"
      ]
    },
    {
      "task_id": "TASK-018",
      "depends_on": [
        "TASK-003",
        "TASK-006"
      ]
    },
    {
      "task_id": "TASK-019",
      "depends_on": [
        "TASK-001",
        "TASK-004"
      ]
    },
    {
      "task_id": "TASK-020",
      "depends_on": [
        "TASK-003",
        "TASK-017",
        "TASK-018",
        "TASK-019",
        "TASK-038"
      ]
    },
    {
      "task_id": "TASK-021",
      "depends_on": [
        "TASK-010",
        "TASK-011",
        "TASK-016",
        "TASK-017",
        "TASK-039"
      ]
    },
    {
      "task_id": "TASK-022",
      "depends_on": [
        "TASK-013",
        "TASK-014",
        "TASK-021",
        "TASK-039"
      ]
    },
    {
      "task_id": "TASK-023",
      "depends_on": [
        "TASK-007",
        "TASK-011",
        "TASK-018",
        "TASK-020",
        "TASK-039"
      ]
    },
    {
      "task_id": "TASK-024",
      "depends_on": [
        "TASK-013",
        "TASK-014",
        "TASK-039"
      ]
    },
    {
      "task_id": "TASK-025",
      "depends_on": [
        "TASK-010",
        "TASK-015",
        "TASK-021",
        "TASK-024",
        "TASK-039"
      ]
    },
    {
      "task_id": "TASK-026",
      "depends_on": [
        "TASK-012",
        "TASK-015",
        "TASK-018",
        "TASK-020",
        "TASK-022",
        "TASK-023",
        "TASK-025",
        "TASK-039"
      ]
    },
    {
      "task_id": "TASK-027",
      "depends_on": [
        "TASK-018",
        "TASK-019",
        "TASK-020",
        "TASK-025",
        "TASK-026",
        "TASK-039"
      ]
    },
    {
      "task_id": "TASK-028",
      "depends_on": [
        "TASK-003",
        "TASK-010"
      ]
    },
    {
      "task_id": "TASK-029",
      "depends_on": [
        "TASK-025",
        "TASK-027",
        "TASK-028",
        "TASK-039"
      ]
    },
    {
      "task_id": "TASK-030",
      "depends_on": [
        "TASK-012",
        "TASK-029",
        "TASK-039"
      ]
    },
    {
      "task_id": "TASK-031",
      "depends_on": [
        "TASK-005",
        "TASK-009",
        "TASK-038"
      ]
    },
    {
      "task_id": "TASK-032",
      "depends_on": [
        "TASK-005",
        "TASK-009",
        "TASK-011",
        "TASK-031"
      ]
    },
    {
      "task_id": "TASK-033",
      "depends_on": [
        "TASK-004",
        "TASK-009",
        "TASK-013"
      ]
    },
    {
      "task_id": "TASK-034",
      "depends_on": [
        "TASK-026",
        "TASK-027",
        "TASK-030",
        "TASK-031",
        "TASK-032",
        "TASK-033",
        "TASK-039"
      ]
    },
    {
      "task_id": "TASK-035",
      "depends_on": [
        "TASK-034"
      ]
    },
    {
      "task_id": "TASK-036",
      "depends_on": [
        "TASK-034"
      ]
    },
    {
      "task_id": "TASK-037",
      "depends_on": [
        "TASK-035",
        "TASK-036"
      ]
    },
    {
      "task_id": "TASK-038",
      "depends_on": [
        "TASK-004"
      ]
    },
    {
      "task_id": "TASK-039",
      "depends_on": [
        "TASK-003"
      ]
    }
  ],
  "task_set_sha256": "1d3085b18c29bb9894d59fea9ee83e2af94feaa02111af6b5c4e7697108a58a8",
  "review_ref": ".ai/reviews/isolation/ISO-PLAN-001-r2.json"
}
